t 0 /NodeList/2/$ns3::Ipv4L3Protocol/Tx(1) ns3::Ipv4Header (tos 0x0 DSCP Default ECN Not-ECT ttl 64 id 0 protocol 6 offset (bytes) 0 flags [none] length: 56 10.1.1.1 > 10.2.2.1) ns3::TcpHeader (49153 > 300 [SYN] Seq=0 Ack=0 Win=65535 ns3::TcpOptionTS(0;0) ns3::TcpOptionWinScale(2) ns3::TcpOptionSackPermitted([sack_perm]) ns3::TcpOptionEnd(EOL))
t 0 /NodeList/3/$ns3::Ipv4L3Protocol/Tx(1) ns3::Ipv4Header (tos 0x0 DSCP Default ECN Not-ECT ttl 64 id 0 protocol 6 offset (bytes) 0 flags [none] length: 56 10.1.2.1 > 10.2.3.1) ns3::TcpHeader (49153 > 300 [SYN] Seq=0 Ack=0 Win=65535 ns3::TcpOptionTS(0;0) ns3::TcpOptionWinScale(2) ns3::TcpOptionSackPermitted([sack_perm]) ns3::TcpOptionEnd(EOL))
r 0.103093 /NodeList/0/$ns3::Ipv4L3Protocol/Rx(2) ns3::Ipv4Header (tos 0x0 DSCP Default ECN Not-ECT ttl 64 id 0 protocol 6 offset (bytes) 0 flags [none] length: 56 10.1.1.1 > 10.2.2.1) ns3::TcpHeader (49153 > 300 [SYN] Seq=0 Ack=0 Win=65535 ns3::TcpOptionTS(0;0) ns3::TcpOptionWinScale(2) ns3::TcpOptionSackPermitted([sack_perm]) ns3::TcpOptionEnd(EOL))
t 0.103093 /NodeList/0/$ns3::Ipv4L3Protocol/Tx(1) ns3::Ipv4Header (tos 0x0 DSCP Default ECN Not-ECT ttl 63 id 0 protocol 6 offset (bytes) 0 flags [none] length: 56 10.1.1.1 > 10.2.2.1) ns3::TcpHeader (49153 > 300 [SYN] Seq=0 Ack=0 Win=65535 ns3::TcpOptionTS(0;0) ns3::TcpOptionWinScale(2) ns3::TcpOptionSackPermitted([sack_perm]) ns3::TcpOptionEnd(EOL))
r 0.103093 /NodeList/0/$ns3::Ipv4L3Protocol/Rx(3) ns3::Ipv4Header (tos 0x0 DSCP Default ECN Not-ECT ttl 64 id 0 protocol 6 offset (bytes) 0 flags [none] length: 56 10.1.2.1 > 10.2.3.1) ns3::TcpHeader (49153 > 300 [SYN] Seq=0 Ack=0 Win=65535 ns3::TcpOptionTS(0;0) ns3::TcpOptionWinScale(2) ns3::TcpOptionSackPermitted([sack_perm]) ns3::TcpOptionEnd(EOL))
t 0.103093 /NodeList/0/$ns3::Ipv4L3Protocol/Tx(1) ns3::Ipv4Header (tos 0x0 DSCP Default ECN Not-ECT ttl 63 id 0 protocol 6 offset (bytes) 0 flags [none] length: 56 10.1.2.1 > 10.2.3.1) ns3::TcpHeader (49153 > 300 [SYN] Seq=0 Ack=0 Win=65535 ns3::TcpOptionTS(0;0) ns3::TcpOptionWinScale(2) ns3::TcpOptionSackPermitted([sack_perm]) ns3::TcpOptionEnd(EOL))
r 0.212373 /NodeList/1/$ns3::Ipv4L3Protocol/Rx(1) ns3::Ipv4Header (tos 0x0 DSCP Default ECN Not-ECT ttl 63 id 0 protocol 6 offset (bytes) 0 flags [none] length: 56 10.1.1.1 > 10.2.2.1) ns3::TcpHeader (49153 > 300 [SYN] Seq=0 Ack=0 Win=65535 ns3::TcpOptionTS(0;0) ns3::TcpOptionWinScale(2) ns3::TcpOptionSackPermitted([sack_perm]) ns3::TcpOptionEnd(EOL))
t 0.212373 /NodeList/1/$ns3::Ipv4L3Protocol/Tx(3) ns3::Ipv4Header (tos 0x0 DSCP Default ECN Not-ECT ttl 62 id 0 protocol 6 offset (bytes) 0 flags [none] length: 56 10.1.1.1 > 10.2.2.1) ns3::TcpHeader (49153 > 300 [SYN] Seq=0 Ack=0 Win=65535 ns3::TcpOptionTS(0;0) ns3::TcpOptionWinScale(2) ns3::TcpOptionSackPermitted([sack_perm]) ns3::TcpOptionEnd(EOL))
r 0.221653 /NodeList/1/$ns3::Ipv4L3Protocol/Rx(1) ns3::Ipv4Header (tos 0x0 DSCP Default ECN Not-ECT ttl 63 id 0 protocol 6 offset (bytes) 0 flags [none] length: 56 10.1.2.1 > 10.2.3.1) ns3::TcpHeader (49153 > 300 [SYN] Seq=0 Ack=0 Win=65535 ns3::TcpOptionTS(0;0) ns3::TcpOptionWinScale(2) ns3::TcpOptionSackPermitted([sack_perm]) ns3::TcpOptionEnd(EOL))
t 0.221653 /NodeList/1/$ns3::Ipv4L3Protocol/Tx(4) ns3::Ipv4Header (tos 0x0 DSCP Default ECN Not-ECT ttl 62 id 0 protocol 6 offset (bytes) 0 flags [none] length: 56 10.1.2.1 > 10.2.3.1) ns3::TcpHeader (49153 > 300 [SYN] Seq=0 Ack=0 Win=65535 ns3::TcpOptionTS(0;0) ns3::TcpOptionWinScale(2) ns3::TcpOptionSackPermitted([sack_perm]) ns3::TcpOptionEnd(EOL))
r 0.315467 /NodeList/6/$ns3::Ipv4L3Protocol/Rx(1) ns3::Ipv4Header (tos 0x0 DSCP Default ECN Not-ECT ttl 62 id 0 protocol 6 offset (bytes) 0 flags [none] length: 56 10.1.1.1 > 10.2.2.1) ns3::TcpHeader (49153 > 300 [SYN] Seq=0 Ack=0 Win=65535 ns3::TcpOptionTS(0;0) ns3::TcpOptionWinScale(2) ns3::TcpOptionSackPermitted([sack_perm]) ns3::TcpOptionEnd(EOL))
t 0.315467 /NodeList/6/$ns3::Ipv4L3Protocol/Tx(1) ns3::Ipv4Header (tos 0x0 DSCP Default ECN Not-ECT ttl 64 id 0 protocol 6 offset (bytes) 0 flags [none] length: 56 10.2.2.1 > 10.1.1.1) ns3::TcpHeader (300 > 49153 [SYN|ACK] Seq=0 Ack=1 Win=65535 ns3::TcpOptionTS(315;0) ns3::TcpOptionWinScale(2) ns3::TcpOptionSackPermitted([sack_perm]) ns3::TcpOptionEnd(EOL))
r 0.324747 /NodeList/7/$ns3::Ipv4L3Protocol/Rx(1) ns3::Ipv4Header (tos 0x0 DSCP Default ECN Not-ECT ttl 62 id 0 protocol 6 offset (bytes) 0 flags [none] length: 56 10.1.2.1 > 10.2.3.1) ns3::TcpHeader (49153 > 300 [SYN] Seq=0 Ack=0 Win=65535 ns3::TcpOptionTS(0;0) ns3::TcpOptionWinScale(2) ns3::TcpOptionSackPermitted([sack_perm]) ns3::TcpOptionEnd(EOL))
t 0.324747 /NodeList/7/$ns3::Ipv4L3Protocol/Tx(1) ns3::Ipv4Header (tos 0x0 DSCP Default ECN Not-ECT ttl 64 id 0 protocol 6 offset (bytes) 0 flags [none] length: 56 10.2.3.1 > 10.1.2.1) ns3::TcpHeader (300 > 49153 [SYN|ACK] Seq=0 Ack=1 Win=65535 ns3::TcpOptionTS(324;0) ns3::TcpOptionWinScale(2) ns3::TcpOptionSackPermitted([sack_perm]) ns3::TcpOptionEnd(EOL))
r 0.41856 /NodeList/1/$ns3::Ipv4L3Protocol/Rx(3) ns3::Ipv4Header (tos 0x0 DSCP Default ECN Not-ECT ttl 64 id 0 protocol 6 offset (bytes) 0 flags [none] length: 56 10.2.2.1 > 10.1.1.1) ns3::TcpHeader (300 > 49153 [SYN|ACK] Seq=0 Ack=1 Win=65535 ns3::TcpOptionTS(315;0) ns3::TcpOptionWinScale(2) ns3::TcpOptionSackPermitted([sack_perm]) ns3::TcpOptionEnd(EOL))
t 0.41856 /NodeList/1/$ns3::Ipv4L3Protocol/Tx(1) ns3::Ipv4Header (tos 0x0 DSCP Default ECN Not-ECT ttl 63 id 0 protocol 6 offset (bytes) 0 flags [none] length: 56 10.2.2.1 > 10.1.1.1) ns3::TcpHeader (300 > 49153 [SYN|ACK] Seq=0 Ack=1 Win=65535 ns3::TcpOptionTS(315;0) ns3::TcpOptionWinScale(2) ns3::TcpOptionSackPermitted([sack_perm]) ns3::TcpOptionEnd(EOL))
r 0.42784 /NodeList/1/$ns3::Ipv4L3Protocol/Rx(4) ns3::Ipv4Header (tos 0x0 DSCP Default ECN Not-ECT ttl 64 id 0 protocol 6 offset (bytes) 0 flags [none] length: 56 10.2.3.1 > 10.1.2.1) ns3::TcpHeader (300 > 49153 [SYN|ACK] Seq=0 Ack=1 Win=65535 ns3::TcpOptionTS(324;0) ns3::TcpOptionWinScale(2) ns3::TcpOptionSackPermitted([sack_perm]) ns3::TcpOptionEnd(EOL))
t 0.42784 /NodeList/1/$ns3::Ipv4L3Protocol/Tx(1) ns3::Ipv4Header (tos 0x0 DSCP Default ECN Not-ECT ttl 63 id 0 protocol 6 offset (bytes) 0 flags [none] length: 56 10.2.3.1 > 10.1.2.1) ns3::TcpHeader (300 > 49153 [SYN|ACK] Seq=0 Ack=1 Win=65535 ns3::TcpOptionTS(324;0) ns3::TcpOptionWinScale(2) ns3::TcpOptionSackPermitted([sack_perm]) ns3::TcpOptionEnd(EOL))
r 0.52784 /NodeList/0/$ns3::Ipv4L3Protocol/Rx(1) ns3::Ipv4Header (tos 0x0 DSCP Default ECN Not-ECT ttl 63 id 0 protocol 6 offset (bytes) 0 flags [none] length: 56 10.2.2.1 > 10.1.1.1) ns3::TcpHeader (300 > 49153 [SYN|ACK] Seq=0 Ack=1 Win=65535 ns3::TcpOptionTS(315;0) ns3::TcpOptionWinScale(2) ns3::TcpOptionSackPermitted([sack_perm]) ns3::TcpOptionEnd(EOL))
t 0.52784 /NodeList/0/$ns3::Ipv4L3Protocol/Tx(2) ns3::Ipv4Header (tos 0x0 DSCP Default ECN Not-ECT ttl 62 id 0 protocol 6 offset (bytes) 0 flags [none] length: 56 10.2.2.1 > 10.1.1.1) ns3::TcpHeader (300 > 49153 [SYN|ACK] Seq=0 Ack=1 Win=65535 ns3::TcpOptionTS(315;0) ns3::TcpOptionWinScale(2) ns3::TcpOptionSackPermitted([sack_perm]) ns3::TcpOptionEnd(EOL))
r 0.53712 /NodeList/0/$ns3::Ipv4L3Protocol/Rx(1) ns3::Ipv4Header (tos 0x0 DSCP Default ECN Not-ECT ttl 63 id 0 protocol 6 offset (bytes) 0 flags [none] length: 56 10.2.3.1 > 10.1.2.1) ns3::TcpHeader (300 > 49153 [SYN|ACK] Seq=0 Ack=1 Win=65535 ns3::TcpOptionTS(324;0) ns3::TcpOptionWinScale(2) ns3::TcpOptionSackPermitted([sack_perm]) ns3::TcpOptionEnd(EOL))
t 0.53712 /NodeList/0/$ns3::Ipv4L3Protocol/Tx(3) ns3::Ipv4Header (tos 0x0 DSCP Default ECN Not-ECT ttl 62 id 0 protocol 6 offset (bytes) 0 flags [none] length: 56 10.2.3.1 > 10.1.2.1) ns3::TcpHeader (300 > 49153 [SYN|ACK] Seq=0 Ack=1 Win=65535 ns3::TcpOptionTS(324;0) ns3::TcpOptionWinScale(2) ns3::TcpOptionSackPermitted([sack_perm]) ns3::TcpOptionEnd(EOL))
r 0.630933 /NodeList/2/$ns3::Ipv4L3Protocol/Rx(1) ns3::Ipv4Header (tos 0x0 DSCP Default ECN Not-ECT ttl 62 id 0 protocol 6 offset (bytes) 0 flags [none] length: 56 10.2.2.1 > 10.1.1.1) ns3::TcpHeader (300 > 49153 [SYN|ACK] Seq=0 Ack=1 Win=65535 ns3::TcpOptionTS(315;0) ns3::TcpOptionWinScale(2) ns3::TcpOptionSackPermitted([sack_perm]) ns3::TcpOptionEnd(EOL))
t 0.630933 /NodeList/2/$ns3::Ipv4L3Protocol/Tx(1) ns3::Ipv4Header (tos 0x0 DSCP Default ECN Not-ECT ttl 64 id 1 protocol 6 offset (bytes) 0 flags [none] length: 52 10.1.1.1 > 10.2.2.1) ns3::TcpHeader (49153 > 300 [ACK] Seq=1 Ack=1 Win=32768 ns3::TcpOptionTS(630;315) ns3::TcpOptionEnd(EOL))
t 0.630933 /NodeList/2/$ns3::Ipv4L3Protocol/Tx(1) ns3::Ipv4Header (tos 0x0 DSCP Default ECN Not-ECT ttl 64 id 2 protocol 6 offset (bytes) 0 flags [none] length: 588 10.1.1.1 > 10.2.2.1) ns3::TcpHeader (49153 > 300 [ACK] Seq=1 Ack=1 Win=32768 ns3::TcpOptionTS(630;315) ns3::TcpOptionEnd(EOL)) Payload (size=512) Payload Fragment [0:24]
r 0.640213 /NodeList/3/$ns3::Ipv4L3Protocol/Rx(1) ns3::Ipv4Header (tos 0x0 DSCP Default ECN Not-ECT ttl 62 id 0 protocol 6 offset (bytes) 0 flags [none] length: 56 10.2.3.1 > 10.1.2.1) ns3::TcpHeader (300 > 49153 [SYN|ACK] Seq=0 Ack=1 Win=65535 ns3::TcpOptionTS(324;0) ns3::TcpOptionWinScale(2) ns3::TcpOptionSackPermitted([sack_perm]) ns3::TcpOptionEnd(EOL))
t 0.640213 /NodeList/3/$ns3::Ipv4L3Protocol/Tx(1) ns3::Ipv4Header (tos 0x0 DSCP Default ECN Not-ECT ttl 64 id 1 protocol 6 offset (bytes) 0 flags [none] length: 52 10.1.2.1 > 10.2.3.1) ns3::TcpHeader (49153 > 300 [ACK] Seq=1 Ack=1 Win=32768 ns3::TcpOptionTS(640;324) ns3::TcpOptionEnd(EOL))
t 0.640213 /NodeList/3/$ns3::Ipv4L3Protocol/Tx(1) ns3::Ipv4Header (tos 0x0 DSCP Default ECN Not-ECT ttl 64 id 2 protocol 6 offset (bytes) 0 flags [none] length: 588 10.1.2.1 > 10.2.3.1) ns3::TcpHeader (49153 > 300 [ACK] Seq=1 Ack=1 Win=32768 ns3::TcpOptionTS(640;324) ns3::TcpOptionEnd(EOL)) Payload (size=512) Payload Fragment [0:24]
r 0.733813 /NodeList/0/$ns3::Ipv4L3Protocol/Rx(2) ns3::Ipv4Header (tos 0x0 DSCP Default ECN Not-ECT ttl 64 id 1 protocol 6 offset (bytes) 0 flags [none] length: 52 10.1.1.1 > 10.2.2.1) ns3::TcpHeader (49153 > 300 [ACK] Seq=1 Ack=1 Win=32768 ns3::TcpOptionTS(630;315) ns3::TcpOptionEnd(EOL))
t 0.733813 /NodeList/0/$ns3::Ipv4L3Protocol/Tx(1) ns3::Ipv4Header (tos 0x0 DSCP Default ECN Not-ECT ttl 63 id 1 protocol 6 offset (bytes) 0 flags [none] length: 52 10.1.1.1 > 10.2.2.1) ns3::TcpHeader (49153 > 300 [ACK] Seq=1 Ack=1 Win=32768 ns3::TcpOptionTS(630;315) ns3::TcpOptionEnd(EOL))
r 0.743093 /NodeList/0/$ns3::Ipv4L3Protocol/Rx(3) ns3::Ipv4Header (tos 0x0 DSCP Default ECN Not-ECT ttl 64 id 1 protocol 6 offset (bytes) 0 flags [none] length: 52 10.1.2.1 > 10.2.3.1) ns3::TcpHeader (49153 > 300 [ACK] Seq=1 Ack=1 Win=32768 ns3::TcpOptionTS(640;324) ns3::TcpOptionEnd(EOL))
t 0.743093 /NodeList/0/$ns3::Ipv4L3Protocol/Tx(1) ns3::Ipv4Header (tos 0x0 DSCP Default ECN Not-ECT ttl 63 id 1 protocol 6 offset (bytes) 0 flags [none] length: 52 10.1.2.1 > 10.2.3.1) ns3::TcpHeader (49153 > 300 [ACK] Seq=1 Ack=1 Win=32768 ns3::TcpOptionTS(640;324) ns3::TcpOptionEnd(EOL))
r 0.76528 /NodeList/0/$ns3::Ipv4L3Protocol/Rx(2) ns3::Ipv4Header (tos 0x0 DSCP Default ECN Not-ECT ttl 64 id 2 protocol 6 offset (bytes) 0 flags [none] length: 588 10.1.1.1 > 10.2.2.1) ns3::TcpHeader (49153 > 300 [ACK] Seq=1 Ack=1 Win=32768 ns3::TcpOptionTS(630;315) ns3::TcpOptionEnd(EOL)) Payload (size=512) Payload Fragment [0:24]
t 0.76528 /NodeList/0/$ns3::Ipv4L3Protocol/Tx(1) ns3::Ipv4Header (tos 0x0 DSCP Default ECN Not-ECT ttl 63 id 2 protocol 6 offset (bytes) 0 flags [none] length: 588 10.1.1.1 > 10.2.2.1) ns3::TcpHeader (49153 > 300 [ACK] Seq=1 Ack=1 Win=32768 ns3::TcpOptionTS(630;315) ns3::TcpOptionEnd(EOL)) Payload (size=512) Payload Fragment [0:24]
r 0.77456 /NodeList/0/$ns3::Ipv4L3Protocol/Rx(3) ns3::Ipv4Header (tos 0x0 DSCP Default ECN Not-ECT ttl 64 id 2 protocol 6 offset (bytes) 0 flags [none] length: 588 10.1.2.1 > 10.2.3.1) ns3::TcpHeader (49153 > 300 [ACK] Seq=1 Ack=1 Win=32768 ns3::TcpOptionTS(640;324) ns3::TcpOptionEnd(EOL)) Payload (size=512) Payload Fragment [0:24]
t 0.77456 /NodeList/0/$ns3::Ipv4L3Protocol/Tx(1) ns3::Ipv4Header (tos 0x0 DSCP Default ECN Not-ECT ttl 63 id 2 protocol 6 offset (bytes) 0 flags [none] length: 588 10.1.2.1 > 10.2.3.1) ns3::TcpHeader (49153 > 300 [ACK] Seq=1 Ack=1 Win=32768 ns3::TcpOptionTS(640;324) ns3::TcpOptionEnd(EOL)) Payload (size=512) Payload Fragment [0:24]
r 0.842453 /NodeList/1/$ns3::Ipv4L3Protocol/Rx(1) ns3::Ipv4Header (tos 0x0 DSCP Default ECN Not-ECT ttl 63 id 1 protocol 6 offset (bytes) 0 flags [none] length: 52 10.1.1.1 > 10.2.2.1) ns3::TcpHeader (49153 > 300 [ACK] Seq=1 Ack=1 Win=32768 ns3::TcpOptionTS(630;315) ns3::TcpOptionEnd(EOL))
t 0.842453 /NodeList/1/$ns3::Ipv4L3Protocol/Tx(3) ns3::Ipv4Header (tos 0x0 DSCP Default ECN Not-ECT ttl 62 id 1 protocol 6 offset (bytes) 0 flags [none] length: 52 10.1.1.1 > 10.2.2.1) ns3::TcpHeader (49153 > 300 [ACK] Seq=1 Ack=1 Win=32768 ns3::TcpOptionTS(630;315) ns3::TcpOptionEnd(EOL))
r 0.851733 /NodeList/1/$ns3::Ipv4L3Protocol/Rx(1) ns3::Ipv4Header (tos 0x0 DSCP Default ECN Not-ECT ttl 63 id 1 protocol 6 offset (bytes) 0 flags [none] length: 52 10.1.2.1 > 10.2.3.1) ns3::TcpHeader (49153 > 300 [ACK] Seq=1 Ack=1 Win=32768 ns3::TcpOptionTS(640;324) ns3::TcpOptionEnd(EOL))
t 0.851733 /NodeList/1/$ns3::Ipv4L3Protocol/Tx(4) ns3::Ipv4Header (tos 0x0 DSCP Default ECN Not-ECT ttl 62 id 1 protocol 6 offset (bytes) 0 flags [none] length: 52 10.1.2.1 > 10.2.3.1) ns3::TcpHeader (49153 > 300 [ACK] Seq=1 Ack=1 Win=32768 ns3::TcpOptionTS(640;324) ns3::TcpOptionEnd(EOL))
r 0.945333 /NodeList/6/$ns3::Ipv4L3Protocol/Rx(1) ns3::Ipv4Header (tos 0x0 DSCP Default ECN Not-ECT ttl 62 id 1 protocol 6 offset (bytes) 0 flags [none] length: 52 10.1.1.1 > 10.2.2.1) ns3::TcpHeader (49153 > 300 [ACK] Seq=1 Ack=1 Win=32768 ns3::TcpOptionTS(630;315) ns3::TcpOptionEnd(EOL))
r 0.954613 /NodeList/7/$ns3::Ipv4L3Protocol/Rx(1) ns3::Ipv4Header (tos 0x0 DSCP Default ECN Not-ECT ttl 62 id 1 protocol 6 offset (bytes) 0 flags [none] length: 52 10.1.2.1 > 10.2.3.1) ns3::TcpHeader (49153 > 300 [ACK] Seq=1 Ack=1 Win=32768 ns3::TcpOptionTS(640;324) ns3::TcpOptionEnd(EOL))
r 0.95968 /NodeList/1/$ns3::Ipv4L3Protocol/Rx(1) ns3::Ipv4Header (tos 0x0 DSCP Default ECN Not-ECT ttl 63 id 2 protocol 6 offset (bytes) 0 flags [none] length: 588 10.1.1.1 > 10.2.2.1) ns3::TcpHeader (49153 > 300 [ACK] Seq=1 Ack=1 Win=32768 ns3::TcpOptionTS(630;315) ns3::TcpOptionEnd(EOL)) Payload (size=512) Payload Fragment [0:24]
t 0.95968 /NodeList/1/$ns3::Ipv4L3Protocol/Tx(3) ns3::Ipv4Header (tos 0x0 DSCP Default ECN Not-ECT ttl 62 id 2 protocol 6 offset (bytes) 0 flags [none] length: 588 10.1.1.1 > 10.2.2.1) ns3::TcpHeader (49153 > 300 [ACK] Seq=1 Ack=1 Win=32768 ns3::TcpOptionTS(630;315) ns3::TcpOptionEnd(EOL)) Payload (size=512) Payload Fragment [0:24]
r 1.05408 /NodeList/1/$ns3::Ipv4L3Protocol/Rx(1) ns3::Ipv4Header (tos 0x0 DSCP Default ECN Not-ECT ttl 63 id 2 protocol 6 offset (bytes) 0 flags [none] length: 588 10.1.2.1 > 10.2.3.1) ns3::TcpHeader (49153 > 300 [ACK] Seq=1 Ack=1 Win=32768 ns3::TcpOptionTS(640;324) ns3::TcpOptionEnd(EOL)) Payload (size=512) Payload Fragment [0:24]
t 1.05408 /NodeList/1/$ns3::Ipv4L3Protocol/Tx(4) ns3::Ipv4Header (tos 0x0 DSCP Default ECN Not-ECT ttl 62 id 2 protocol 6 offset (bytes) 0 flags [none] length: 588 10.1.2.1 > 10.2.3.1) ns3::TcpHeader (49153 > 300 [ACK] Seq=1 Ack=1 Win=32768 ns3::TcpOptionTS(640;324) ns3::TcpOptionEnd(EOL)) Payload (size=512) Payload Fragment [0:24]
r 1.09115 /NodeList/6/$ns3::Ipv4L3Protocol/Rx(1) ns3::Ipv4Header (tos 0x0 DSCP Default ECN Not-ECT ttl 62 id 2 protocol 6 offset (bytes) 0 flags [none] length: 588 10.1.1.1 > 10.2.2.1) ns3::TcpHeader (49153 > 300 [ACK] Seq=1 Ack=1 Win=32768 ns3::TcpOptionTS(630;315) ns3::TcpOptionEnd(EOL)) Payload (size=512) Payload Fragment [0:24]
t 1.09115 /NodeList/6/$ns3::Ipv4L3Protocol/Tx(1) ns3::Ipv4Header (tos 0x0 DSCP Default ECN Not-ECT ttl 64 id 1 protocol 6 offset (bytes) 0 flags [none] length: 52 10.2.2.1 > 10.1.1.1) ns3::TcpHeader (300 > 49153 [ACK] Seq=1 Ack=537 Win=32768 ns3::TcpOptionTS(1091;630) ns3::TcpOptionEnd(EOL))
r 1.18555 /NodeList/7/$ns3::Ipv4L3Protocol/Rx(1) ns3::Ipv4Header (tos 0x0 DSCP Default ECN Not-ECT ttl 62 id 2 protocol 6 offset (bytes) 0 flags [none] length: 588 10.1.2.1 > 10.2.3.1) ns3::TcpHeader (49153 > 300 [ACK] Seq=1 Ack=1 Win=32768 ns3::TcpOptionTS(640;324) ns3::TcpOptionEnd(EOL)) Payload (size=512) Payload Fragment [0:24]
t 1.18555 /NodeList/7/$ns3::Ipv4L3Protocol/Tx(1) ns3::Ipv4Header (tos 0x0 DSCP Default ECN Not-ECT ttl 64 id 1 protocol 6 offset (bytes) 0 flags [none] length: 52 10.2.3.1 > 10.1.2.1) ns3::TcpHeader (300 > 49153 [ACK] Seq=1 Ack=537 Win=32768 ns3::TcpOptionTS(1185;640) ns3::TcpOptionEnd(EOL))
r 1.19403 /NodeList/1/$ns3::Ipv4L3Protocol/Rx(3) ns3::Ipv4Header (tos 0x0 DSCP Default ECN Not-ECT ttl 64 id 1 protocol 6 offset (bytes) 0 flags [none] length: 52 10.2.2.1 > 10.1.1.1) ns3::TcpHeader (300 > 49153 [ACK] Seq=1 Ack=537 Win=32768 ns3::TcpOptionTS(1091;630) ns3::TcpOptionEnd(EOL))
t 1.19403 /NodeList/1/$ns3::Ipv4L3Protocol/Tx(1) ns3::Ipv4Header (tos 0x0 DSCP Default ECN Not-ECT ttl 63 id 1 protocol 6 offset (bytes) 0 flags [none] length: 52 10.2.2.1 > 10.1.1.1) ns3::TcpHeader (300 > 49153 [ACK] Seq=1 Ack=537 Win=32768 ns3::TcpOptionTS(1091;630) ns3::TcpOptionEnd(EOL))
r 1.28843 /NodeList/1/$ns3::Ipv4L3Protocol/Rx(4) ns3::Ipv4Header (tos 0x0 DSCP Default ECN Not-ECT ttl 64 id 1 protocol 6 offset (bytes) 0 flags [none] length: 52 10.2.3.1 > 10.1.2.1) ns3::TcpHeader (300 > 49153 [ACK] Seq=1 Ack=537 Win=32768 ns3::TcpOptionTS(1185;640) ns3::TcpOptionEnd(EOL))
t 1.28843 /NodeList/1/$ns3::Ipv4L3Protocol/Tx(1) ns3::Ipv4Header (tos 0x0 DSCP Default ECN Not-ECT ttl 63 id 1 protocol 6 offset (bytes) 0 flags [none] length: 52 10.2.3.1 > 10.1.2.1) ns3::TcpHeader (300 > 49153 [ACK] Seq=1 Ack=537 Win=32768 ns3::TcpOptionTS(1185;640) ns3::TcpOptionEnd(EOL))
r 1.30267 /NodeList/0/$ns3::Ipv4L3Protocol/Rx(1) ns3::Ipv4Header (tos 0x0 DSCP Default ECN Not-ECT ttl 63 id 1 protocol 6 offset (bytes) 0 flags [none] length: 52 10.2.2.1 > 10.1.1.1) ns3::TcpHeader (300 > 49153 [ACK] Seq=1 Ack=537 Win=32768 ns3::TcpOptionTS(1091;630) ns3::TcpOptionEnd(EOL))
t 1.30267 /NodeList/0/$ns3::Ipv4L3Protocol/Tx(2) ns3::Ipv4Header (tos 0x0 DSCP Default ECN Not-ECT ttl 62 id 1 protocol 6 offset (bytes) 0 flags [none] length: 52 10.2.2.1 > 10.1.1.1) ns3::TcpHeader (300 > 49153 [ACK] Seq=1 Ack=537 Win=32768 ns3::TcpOptionTS(1091;630) ns3::TcpOptionEnd(EOL))
r 1.39707 /NodeList/0/$ns3::Ipv4L3Protocol/Rx(1) ns3::Ipv4Header (tos 0x0 DSCP Default ECN Not-ECT ttl 63 id 1 protocol 6 offset (bytes) 0 flags [none] length: 52 10.2.3.1 > 10.1.2.1) ns3::TcpHeader (300 > 49153 [ACK] Seq=1 Ack=537 Win=32768 ns3::TcpOptionTS(1185;640) ns3::TcpOptionEnd(EOL))
t 1.39707 /NodeList/0/$ns3::Ipv4L3Protocol/Tx(3) ns3::Ipv4Header (tos 0x0 DSCP Default ECN Not-ECT ttl 62 id 1 protocol 6 offset (bytes) 0 flags [none] length: 52 10.2.3.1 > 10.1.2.1) ns3::TcpHeader (300 > 49153 [ACK] Seq=1 Ack=537 Win=32768 ns3::TcpOptionTS(1185;640) ns3::TcpOptionEnd(EOL))
r 1.40555 /NodeList/2/$ns3::Ipv4L3Protocol/Rx(1) ns3::Ipv4Header (tos 0x0 DSCP Default ECN Not-ECT ttl 62 id 1 protocol 6 offset (bytes) 0 flags [none] length: 52 10.2.2.1 > 10.1.1.1) ns3::TcpHeader (300 > 49153 [ACK] Seq=1 Ack=537 Win=32768 ns3::TcpOptionTS(1091;630) ns3::TcpOptionEnd(EOL))
t 1.40555 /NodeList/2/$ns3::Ipv4L3Protocol/Tx(1) ns3::Ipv4Header (tos 0x0 DSCP Default ECN Not-ECT ttl 64 id 3 protocol 6 offset (bytes) 0 flags [none] length: 588 10.1.1.1 > 10.2.2.1) ns3::TcpHeader (49153 > 300 [ACK] Seq=537 Ack=1 Win=32768 ns3::TcpOptionTS(1405;1091) ns3::TcpOptionEnd(EOL)) Payload Fragment [24:512] Payload Fragment [0:48]
t 1.40555 /NodeList/2/$ns3::Ipv4L3Protocol/Tx(1) ns3::Ipv4Header (tos 0x0 DSCP Default ECN Not-ECT ttl 64 id 4 protocol 6 offset (bytes) 0 flags [none] length: 588 10.1.1.1 > 10.2.2.1) ns3::TcpHeader (49153 > 300 [ACK] Seq=1073 Ack=1 Win=32768 ns3::TcpOptionTS(1405;1091) ns3::TcpOptionEnd(EOL)) Payload Fragment [48:512] Payload Fragment [0:72]
r 1.49995 /NodeList/3/$ns3::Ipv4L3Protocol/Rx(1) ns3::Ipv4Header (tos 0x0 DSCP Default ECN Not-ECT ttl 62 id 1 protocol 6 offset (bytes) 0 flags [none] length: 52 10.2.3.1 > 10.1.2.1) ns3::TcpHeader (300 > 49153 [ACK] Seq=1 Ack=537 Win=32768 ns3::TcpOptionTS(1185;640) ns3::TcpOptionEnd(EOL))
t 1.49995 /NodeList/3/$ns3::Ipv4L3Protocol/Tx(1) ns3::Ipv4Header (tos 0x0 DSCP Default ECN Not-ECT ttl 64 id 3 protocol 6 offset (bytes) 0 flags [none] length: 588 10.1.2.1 > 10.2.3.1) ns3::TcpHeader (49153 > 300 [ACK] Seq=537 Ack=1 Win=32768 ns3::TcpOptionTS(1499;1185) ns3::TcpOptionEnd(EOL)) Payload Fragment [24:512] Payload Fragment [0:48]
t 1.49995 /NodeList/3/$ns3::Ipv4L3Protocol/Tx(1) ns3::Ipv4Header (tos 0x0 DSCP Default ECN Not-ECT ttl 64 id 4 protocol 6 offset (bytes) 0 flags [none] length: 588 10.1.2.1 > 10.2.3.1) ns3::TcpHeader (49153 > 300 [ACK] Seq=1073 Ack=1 Win=32768 ns3::TcpOptionTS(1499;1185) ns3::TcpOptionEnd(EOL)) Payload Fragment [48:512] Payload Fragment [0:72]
r 1.53701 /NodeList/0/$ns3::Ipv4L3Protocol/Rx(2) ns3::Ipv4Header (tos 0x0 DSCP Default ECN Not-ECT ttl 64 id 3 protocol 6 offset (bytes) 0 flags [none] length: 588 10.1.1.1 > 10.2.2.1) ns3::TcpHeader (49153 > 300 [ACK] Seq=537 Ack=1 Win=32768 ns3::TcpOptionTS(1405;1091) ns3::TcpOptionEnd(EOL)) Payload Fragment [24:512] Payload Fragment [0:48]
t 1.53701 /NodeList/0/$ns3::Ipv4L3Protocol/Tx(1) ns3::Ipv4Header (tos 0x0 DSCP Default ECN Not-ECT ttl 63 id 3 protocol 6 offset (bytes) 0 flags [none] length: 588 10.1.1.1 > 10.2.2.1) ns3::TcpHeader (49153 > 300 [ACK] Seq=537 Ack=1 Win=32768 ns3::TcpOptionTS(1405;1091) ns3::TcpOptionEnd(EOL)) Payload Fragment [24:512] Payload Fragment [0:48]
r 1.56848 /NodeList/0/$ns3::Ipv4L3Protocol/Rx(2) ns3::Ipv4Header (tos 0x0 DSCP Default ECN Not-ECT ttl 64 id 4 protocol 6 offset (bytes) 0 flags [none] length: 588 10.1.1.1 > 10.2.2.1) ns3::TcpHeader (49153 > 300 [ACK] Seq=1073 Ack=1 Win=32768 ns3::TcpOptionTS(1405;1091) ns3::TcpOptionEnd(EOL)) Payload Fragment [48:512] Payload Fragment [0:72]
t 1.56848 /NodeList/0/$ns3::Ipv4L3Protocol/Tx(1) ns3::Ipv4Header (tos 0x0 DSCP Default ECN Not-ECT ttl 63 id 4 protocol 6 offset (bytes) 0 flags [none] length: 588 10.1.1.1 > 10.2.2.1) ns3::TcpHeader (49153 > 300 [ACK] Seq=1073 Ack=1 Win=32768 ns3::TcpOptionTS(1405;1091) ns3::TcpOptionEnd(EOL)) Payload Fragment [48:512] Payload Fragment [0:72]
r 1.63141 /NodeList/0/$ns3::Ipv4L3Protocol/Rx(3) ns3::Ipv4Header (tos 0x0 DSCP Default ECN Not-ECT ttl 64 id 3 protocol 6 offset (bytes) 0 flags [none] length: 588 10.1.2.1 > 10.2.3.1) ns3::TcpHeader (49153 > 300 [ACK] Seq=537 Ack=1 Win=32768 ns3::TcpOptionTS(1499;1185) ns3::TcpOptionEnd(EOL)) Payload Fragment [24:512] Payload Fragment [0:48]
t 1.63141 /NodeList/0/$ns3::Ipv4L3Protocol/Tx(1) ns3::Ipv4Header (tos 0x0 DSCP Default ECN Not-ECT ttl 63 id 3 protocol 6 offset (bytes) 0 flags [none] length: 588 10.1.2.1 > 10.2.3.1) ns3::TcpHeader (49153 > 300 [ACK] Seq=537 Ack=1 Win=32768 ns3::TcpOptionTS(1499;1185) ns3::TcpOptionEnd(EOL)) Payload Fragment [24:512] Payload Fragment [0:48]
r 1.66288 /NodeList/0/$ns3::Ipv4L3Protocol/Rx(3) ns3::Ipv4Header (tos 0x0 DSCP Default ECN Not-ECT ttl 64 id 4 protocol 6 offset (bytes) 0 flags [none] length: 588 10.1.2.1 > 10.2.3.1) ns3::TcpHeader (49153 > 300 [ACK] Seq=1073 Ack=1 Win=32768 ns3::TcpOptionTS(1499;1185) ns3::TcpOptionEnd(EOL)) Payload Fragment [48:512] Payload Fragment [0:72]
t 1.66288 /NodeList/0/$ns3::Ipv4L3Protocol/Tx(1) ns3::Ipv4Header (tos 0x0 DSCP Default ECN Not-ECT ttl 63 id 4 protocol 6 offset (bytes) 0 flags [none] length: 588 10.1.2.1 > 10.2.3.1) ns3::TcpHeader (49153 > 300 [ACK] Seq=1073 Ack=1 Win=32768 ns3::TcpOptionTS(1499;1185) ns3::TcpOptionEnd(EOL)) Payload Fragment [48:512] Payload Fragment [0:72]
r 1.73141 /NodeList/1/$ns3::Ipv4L3Protocol/Rx(1) ns3::Ipv4Header (tos 0x0 DSCP Default ECN Not-ECT ttl 63 id 3 protocol 6 offset (bytes) 0 flags [none] length: 588 10.1.1.1 > 10.2.2.1) ns3::TcpHeader (49153 > 300 [ACK] Seq=537 Ack=1 Win=32768 ns3::TcpOptionTS(1405;1091) ns3::TcpOptionEnd(EOL)) Payload Fragment [24:512] Payload Fragment [0:48]
t 1.73141 /NodeList/1/$ns3::Ipv4L3Protocol/Tx(3) ns3::Ipv4Header (tos 0x0 DSCP Default ECN Not-ECT ttl 62 id 3 protocol 6 offset (bytes) 0 flags [none] length: 588 10.1.1.1 > 10.2.2.1) ns3::TcpHeader (49153 > 300 [ACK] Seq=537 Ack=1 Win=32768 ns3::TcpOptionTS(1405;1091) ns3::TcpOptionEnd(EOL)) Payload Fragment [24:512] Payload Fragment [0:48]
r 1.82581 /NodeList/1/$ns3::Ipv4L3Protocol/Rx(1) ns3::Ipv4Header (tos 0x0 DSCP Default ECN Not-ECT ttl 63 id 4 protocol 6 offset (bytes) 0 flags [none] length: 588 10.1.1.1 > 10.2.2.1) ns3::TcpHeader (49153 > 300 [ACK] Seq=1073 Ack=1 Win=32768 ns3::TcpOptionTS(1405;1091) ns3::TcpOptionEnd(EOL)) Payload Fragment [48:512] Payload Fragment [0:72]
t 1.82581 /NodeList/1/$ns3::Ipv4L3Protocol/Tx(3) ns3::Ipv4Header (tos 0x0 DSCP Default ECN Not-ECT ttl 62 id 4 protocol 6 offset (bytes) 0 flags [none] length: 588 10.1.1.1 > 10.2.2.1) ns3::TcpHeader (49153 > 300 [ACK] Seq=1073 Ack=1 Win=32768 ns3::TcpOptionTS(1405;1091) ns3::TcpOptionEnd(EOL)) Payload Fragment [48:512] Payload Fragment [0:72]
r 1.86288 /NodeList/6/$ns3::Ipv4L3Protocol/Rx(1) ns3::Ipv4Header (tos 0x0 DSCP Default ECN Not-ECT ttl 62 id 3 protocol 6 offset (bytes) 0 flags [none] length: 588 10.1.1.1 > 10.2.2.1) ns3::TcpHeader (49153 > 300 [ACK] Seq=537 Ack=1 Win=32768 ns3::TcpOptionTS(1405;1091) ns3::TcpOptionEnd(EOL)) Payload Fragment [24:512] Payload Fragment [0:48]
r 1.92021 /NodeList/1/$ns3::Ipv4L3Protocol/Rx(1) ns3::Ipv4Header (tos 0x0 DSCP Default ECN Not-ECT ttl 63 id 3 protocol 6 offset (bytes) 0 flags [none] length: 588 10.1.2.1 > 10.2.3.1) ns3::TcpHeader (49153 > 300 [ACK] Seq=537 Ack=1 Win=32768 ns3::TcpOptionTS(1499;1185) ns3::TcpOptionEnd(EOL)) Payload Fragment [24:512] Payload Fragment [0:48]
t 1.92021 /NodeList/1/$ns3::Ipv4L3Protocol/Tx(4) ns3::Ipv4Header (tos 0x0 DSCP Default ECN Not-ECT ttl 62 id 3 protocol 6 offset (bytes) 0 flags [none] length: 588 10.1.2.1 > 10.2.3.1) ns3::TcpHeader (49153 > 300 [ACK] Seq=537 Ack=1 Win=32768 ns3::TcpOptionTS(1499;1185) ns3::TcpOptionEnd(EOL)) Payload Fragment [24:512] Payload Fragment [0:48]
r 1.95728 /NodeList/6/$ns3::Ipv4L3Protocol/Rx(1) ns3::Ipv4Header (tos 0x0 DSCP Default ECN Not-ECT ttl 62 id 4 protocol 6 offset (bytes) 0 flags [none] length: 588 10.1.1.1 > 10.2.2.1) ns3::TcpHeader (49153 > 300 [ACK] Seq=1073 Ack=1 Win=32768 ns3::TcpOptionTS(1405;1091) ns3::TcpOptionEnd(EOL)) Payload Fragment [48:512] Payload Fragment [0:72]
t 1.95728 /NodeList/6/$ns3::Ipv4L3Protocol/Tx(1) ns3::Ipv4Header (tos 0x0 DSCP Default ECN Not-ECT ttl 64 id 2 protocol 6 offset (bytes) 0 flags [none] length: 52 10.2.2.1 > 10.1.1.1) ns3::TcpHeader (300 > 49153 [ACK] Seq=1 Ack=1609 Win=32768 ns3::TcpOptionTS(1957;1405) ns3::TcpOptionEnd(EOL))
r 2.01461 /NodeList/1/$ns3::Ipv4L3Protocol/Rx(1) ns3::Ipv4Header (tos 0x0 DSCP Default ECN Not-ECT ttl 63 id 4 protocol 6 offset (bytes) 0 flags [none] length: 588 10.1.2.1 > 10.2.3.1) ns3::TcpHeader (49153 > 300 [ACK] Seq=1073 Ack=1 Win=32768 ns3::TcpOptionTS(1499;1185) ns3::TcpOptionEnd(EOL)) Payload Fragment [48:512] Payload Fragment [0:72]
t 2.01461 /NodeList/1/$ns3::Ipv4L3Protocol/Tx(4) ns3::Ipv4Header (tos 0x0 DSCP Default ECN Not-ECT ttl 62 id 4 protocol 6 offset (bytes) 0 flags [none] length: 588 10.1.2.1 > 10.2.3.1) ns3::TcpHeader (49153 > 300 [ACK] Seq=1073 Ack=1 Win=32768 ns3::TcpOptionTS(1499;1185) ns3::TcpOptionEnd(EOL)) Payload Fragment [48:512] Payload Fragment [0:72]
r 2.05168 /NodeList/7/$ns3::Ipv4L3Protocol/Rx(1) ns3::Ipv4Header (tos 0x0 DSCP Default ECN Not-ECT ttl 62 id 3 protocol 6 offset (bytes) 0 flags [none] length: 588 10.1.2.1 > 10.2.3.1) ns3::TcpHeader (49153 > 300 [ACK] Seq=537 Ack=1 Win=32768 ns3::TcpOptionTS(1499;1185) ns3::TcpOptionEnd(EOL)) Payload Fragment [24:512] Payload Fragment [0:48]
r 2.06016 /NodeList/1/$ns3::Ipv4L3Protocol/Rx(3) ns3::Ipv4Header (tos 0x0 DSCP Default ECN Not-ECT ttl 64 id 2 protocol 6 offset (bytes) 0 flags [none] length: 52 10.2.2.1 > 10.1.1.1) ns3::TcpHeader (300 > 49153 [ACK] Seq=1 Ack=1609 Win=32768 ns3::TcpOptionTS(1957;1405) ns3::TcpOptionEnd(EOL))
t 2.06016 /NodeList/1/$ns3::Ipv4L3Protocol/Tx(1) ns3::Ipv4Header (tos 0x0 DSCP Default ECN Not-ECT ttl 63 id 2 protocol 6 offset (bytes) 0 flags [none] length: 52 10.2.2.1 > 10.1.1.1) ns3::TcpHeader (300 > 49153 [ACK] Seq=1 Ack=1609 Win=32768 ns3::TcpOptionTS(1957;1405) ns3::TcpOptionEnd(EOL))
r 2.14608 /NodeList/7/$ns3::Ipv4L3Protocol/Rx(1) ns3::Ipv4Header (tos 0x0 DSCP Default ECN Not-ECT ttl 62 id 4 protocol 6 offset (bytes) 0 flags [none] length: 588 10.1.2.1 > 10.2.3.1) ns3::TcpHeader (49153 > 300 [ACK] Seq=1073 Ack=1 Win=32768 ns3::TcpOptionTS(1499;1185) ns3::TcpOptionEnd(EOL)) Payload Fragment [48:512] Payload Fragment [0:72]
t 2.14608 /NodeList/7/$ns3::Ipv4L3Protocol/Tx(1) ns3::Ipv4Header (tos 0x0 DSCP Default ECN Not-ECT ttl 64 id 2 protocol 6 offset (bytes) 0 flags [none] length: 52 10.2.3.1 > 10.1.2.1) ns3::TcpHeader (300 > 49153 [ACK] Seq=1 Ack=1609 Win=32768 ns3::TcpOptionTS(2146;1499) ns3::TcpOptionEnd(EOL))
r 2.1688 /NodeList/0/$ns3::Ipv4L3Protocol/Rx(1) ns3::Ipv4Header (tos 0x0 DSCP Default ECN Not-ECT ttl 63 id 2 protocol 6 offset (bytes) 0 flags [none] length: 52 10.2.2.1 > 10.1.1.1) ns3::TcpHeader (300 > 49153 [ACK] Seq=1 Ack=1609 Win=32768 ns3::TcpOptionTS(1957;1405) ns3::TcpOptionEnd(EOL))
t 2.1688 /NodeList/0/$ns3::Ipv4L3Protocol/Tx(2) ns3::Ipv4Header (tos 0x0 DSCP Default ECN Not-ECT ttl 62 id 2 protocol 6 offset (bytes) 0 flags [none] length: 52 10.2.2.1 > 10.1.1.1) ns3::TcpHeader (300 > 49153 [ACK] Seq=1 Ack=1609 Win=32768 ns3::TcpOptionTS(1957;1405) ns3::TcpOptionEnd(EOL))
r 2.24896 /NodeList/1/$ns3::Ipv4L3Protocol/Rx(4) ns3::Ipv4Header (tos 0x0 DSCP Default ECN Not-ECT ttl 64 id 2 protocol 6 offset (bytes) 0 flags [none] length: 52 10.2.3.1 > 10.1.2.1) ns3::TcpHeader (300 > 49153 [ACK] Seq=1 Ack=1609 Win=32768 ns3::TcpOptionTS(2146;1499) ns3::TcpOptionEnd(EOL))
t 2.24896 /NodeList/1/$ns3::Ipv4L3Protocol/Tx(1) ns3::Ipv4Header (tos 0x0 DSCP Default ECN Not-ECT ttl 63 id 2 protocol 6 offset (bytes) 0 flags [none] length: 52 10.2.3.1 > 10.1.2.1) ns3::TcpHeader (300 > 49153 [ACK] Seq=1 Ack=1609 Win=32768 ns3::TcpOptionTS(2146;1499) ns3::TcpOptionEnd(EOL))
r 2.27168 /NodeList/2/$ns3::Ipv4L3Protocol/Rx(1) ns3::Ipv4Header (tos 0x0 DSCP Default ECN Not-ECT ttl 62 id 2 protocol 6 offset (bytes) 0 flags [none] length: 52 10.2.2.1 > 10.1.1.1) ns3::TcpHeader (300 > 49153 [ACK] Seq=1 Ack=1609 Win=32768 ns3::TcpOptionTS(1957;1405) ns3::TcpOptionEnd(EOL))
t 2.27168 /NodeList/2/$ns3::Ipv4L3Protocol/Tx(1) ns3::Ipv4Header (tos 0x0 DSCP Default ECN Not-ECT ttl 64 id 5 protocol 6 offset (bytes) 0 flags [none] length: 588 10.1.1.1 > 10.2.2.1) ns3::TcpHeader (49153 > 300 [ACK] Seq=1609 Ack=1 Win=32768 ns3::TcpOptionTS(2271;1957) ns3::TcpOptionEnd(EOL)) Payload Fragment [72:512] Payload Fragment [0:96]
t 2.27168 /NodeList/2/$ns3::Ipv4L3Protocol/Tx(1) ns3::Ipv4Header (tos 0x0 DSCP Default ECN Not-ECT ttl 64 id 6 protocol 6 offset (bytes) 0 flags [none] length: 588 10.1.1.1 > 10.2.2.1) ns3::TcpHeader (49153 > 300 [ACK] Seq=2145 Ack=1 Win=32768 ns3::TcpOptionTS(2271;1957) ns3::TcpOptionEnd(EOL)) Payload Fragment [96:512] Payload Fragment [0:120]
t 2.27168 /NodeList/2/$ns3::Ipv4L3Protocol/Tx(1) ns3::Ipv4Header (tos 0x0 DSCP Default ECN Not-ECT ttl 64 id 7 protocol 6 offset (bytes) 0 flags [none] length: 588 10.1.1.1 > 10.2.2.1) ns3::TcpHeader (49153 > 300 [ACK] Seq=2681 Ack=1 Win=32768 ns3::TcpOptionTS(2271;1957) ns3::TcpOptionEnd(EOL)) Payload Fragment [120:512] Payload Fragment [0:144]
r 2.3576 /NodeList/0/$ns3::Ipv4L3Protocol/Rx(1) ns3::Ipv4Header (tos 0x0 DSCP Default ECN Not-ECT ttl 63 id 2 protocol 6 offset (bytes) 0 flags [none] length: 52 10.2.3.1 > 10.1.2.1) ns3::TcpHeader (300 > 49153 [ACK] Seq=1 Ack=1609 Win=32768 ns3::TcpOptionTS(2146;1499) ns3::TcpOptionEnd(EOL))
t 2.3576 /NodeList/0/$ns3::Ipv4L3Protocol/Tx(3) ns3::Ipv4Header (tos 0x0 DSCP Default ECN Not-ECT ttl 62 id 2 protocol 6 offset (bytes) 0 flags [none] length: 52 10.2.3.1 > 10.1.2.1) ns3::TcpHeader (300 > 49153 [ACK] Seq=1 Ack=1609 Win=32768 ns3::TcpOptionTS(2146;1499) ns3::TcpOptionEnd(EOL))
r 2.40315 /NodeList/0/$ns3::Ipv4L3Protocol/Rx(2) ns3::Ipv4Header (tos 0x0 DSCP Default ECN Not-ECT ttl 64 id 5 protocol 6 offset (bytes) 0 flags [none] length: 588 10.1.1.1 > 10.2.2.1) ns3::TcpHeader (49153 > 300 [ACK] Seq=1609 Ack=1 Win=32768 ns3::TcpOptionTS(2271;1957) ns3::TcpOptionEnd(EOL)) Payload Fragment [72:512] Payload Fragment [0:96]
t 2.40315 /NodeList/0/$ns3::Ipv4L3Protocol/Tx(1) ns3::Ipv4Header (tos 0x0 DSCP Default ECN Not-ECT ttl 63 id 5 protocol 6 offset (bytes) 0 flags [none] length: 588 10.1.1.1 > 10.2.2.1) ns3::TcpHeader (49153 > 300 [ACK] Seq=1609 Ack=1 Win=32768 ns3::TcpOptionTS(2271;1957) ns3::TcpOptionEnd(EOL)) Payload Fragment [72:512] Payload Fragment [0:96]
r 2.43461 /NodeList/0/$ns3::Ipv4L3Protocol/Rx(2) ns3::Ipv4Header (tos 0x0 DSCP Default ECN Not-ECT ttl 64 id 6 protocol 6 offset (bytes) 0 flags [none] length: 588 10.1.1.1 > 10.2.2.1) ns3::TcpHeader (49153 > 300 [ACK] Seq=2145 Ack=1 Win=32768 ns3::TcpOptionTS(2271;1957) ns3::TcpOptionEnd(EOL)) Payload Fragment [96:512] Payload Fragment [0:120]
t 2.43461 /NodeList/0/$ns3::Ipv4L3Protocol/Tx(1) ns3::Ipv4Header (tos 0x0 DSCP Default ECN Not-ECT ttl 63 id 6 protocol 6 offset (bytes) 0 flags [none] length: 588 10.1.1.1 > 10.2.2.1) ns3::TcpHeader (49153 > 300 [ACK] Seq=2145 Ack=1 Win=32768 ns3::TcpOptionTS(2271;1957) ns3::TcpOptionEnd(EOL)) Payload Fragment [96:512] Payload Fragment [0:120]
r 2.46048 /NodeList/3/$ns3::Ipv4L3Protocol/Rx(1) ns3::Ipv4Header (tos 0x0 DSCP Default ECN Not-ECT ttl 62 id 2 protocol 6 offset (bytes) 0 flags [none] length: 52 10.2.3.1 > 10.1.2.1) ns3::TcpHeader (300 > 49153 [ACK] Seq=1 Ack=1609 Win=32768 ns3::TcpOptionTS(2146;1499) ns3::TcpOptionEnd(EOL))
t 2.46048 /NodeList/3/$ns3::Ipv4L3Protocol/Tx(1) ns3::Ipv4Header (tos 0x0 DSCP Default ECN Not-ECT ttl 64 id 5 protocol 6 offset (bytes) 0 flags [none] length: 588 10.1.2.1 > 10.2.3.1) ns3::TcpHeader (49153 > 300 [ACK] Seq=1609 Ack=1 Win=32768 ns3::TcpOptionTS(2460;2146) ns3::TcpOptionEnd(EOL)) Payload Fragment [72:512] Payload Fragment [0:96]
t 2.46048 /NodeList/3/$ns3::Ipv4L3Protocol/Tx(1) ns3::Ipv4Header (tos 0x0 DSCP Default ECN Not-ECT ttl 64 id 6 protocol 6 offset (bytes) 0 flags [none] length: 588 10.1.2.1 > 10.2.3.1) ns3::TcpHeader (49153 > 300 [ACK] Seq=2145 Ack=1 Win=32768 ns3::TcpOptionTS(2460;2146) ns3::TcpOptionEnd(EOL)) Payload Fragment [96:512] Payload Fragment [0:120]
t 2.46048 /NodeList/3/$ns3::Ipv4L3Protocol/Tx(1) ns3::Ipv4Header (tos 0x0 DSCP Default ECN Not-ECT ttl 64 id 7 protocol 6 offset (bytes) 0 flags [none] length: 588 10.1.2.1 > 10.2.3.1) ns3::TcpHeader (49153 > 300 [ACK] Seq=2681 Ack=1 Win=32768 ns3::TcpOptionTS(2460;2146) ns3::TcpOptionEnd(EOL)) Payload Fragment [120:512] Payload Fragment [0:144]
r 2.46608 /NodeList/0/$ns3::Ipv4L3Protocol/Rx(2) ns3::Ipv4Header (tos 0x0 DSCP Default ECN Not-ECT ttl 64 id 7 protocol 6 offset (bytes) 0 flags [none] length: 588 10.1.1.1 > 10.2.2.1) ns3::TcpHeader (49153 > 300 [ACK] Seq=2681 Ack=1 Win=32768 ns3::TcpOptionTS(2271;1957) ns3::TcpOptionEnd(EOL)) Payload Fragment [120:512] Payload Fragment [0:144]
t 2.46608 /NodeList/0/$ns3::Ipv4L3Protocol/Tx(1) ns3::Ipv4Header (tos 0x0 DSCP Default ECN Not-ECT ttl 63 id 7 protocol 6 offset (bytes) 0 flags [none] length: 588 10.1.1.1 > 10.2.2.1) ns3::TcpHeader (49153 > 300 [ACK] Seq=2681 Ack=1 Win=32768 ns3::TcpOptionTS(2271;1957) ns3::TcpOptionEnd(EOL)) Payload Fragment [120:512] Payload Fragment [0:144]
r 2.59195 /NodeList/0/$ns3::Ipv4L3Protocol/Rx(3) ns3::Ipv4Header (tos 0x0 DSCP Default ECN Not-ECT ttl 64 id 5 protocol 6 offset (bytes) 0 flags [none] length: 588 10.1.2.1 > 10.2.3.1) ns3::TcpHeader (49153 > 300 [ACK] Seq=1609 Ack=1 Win=32768 ns3::TcpOptionTS(2460;2146) ns3::TcpOptionEnd(EOL)) Payload Fragment [72:512] Payload Fragment [0:96]
t 2.59195 /NodeList/0/$ns3::Ipv4L3Protocol/Tx(1) ns3::Ipv4Header (tos 0x0 DSCP Default ECN Not-ECT ttl 63 id 5 protocol 6 offset (bytes) 0 flags [none] length: 588 10.1.2.1 > 10.2.3.1) ns3::TcpHeader (49153 > 300 [ACK] Seq=1609 Ack=1 Win=32768 ns3::TcpOptionTS(2460;2146) ns3::TcpOptionEnd(EOL)) Payload Fragment [72:512] Payload Fragment [0:96]
r 2.59755 /NodeList/1/$ns3::Ipv4L3Protocol/Rx(1) ns3::Ipv4Header (tos 0x0 DSCP Default ECN Not-ECT ttl 63 id 5 protocol 6 offset (bytes) 0 flags [none] length: 588 10.1.1.1 > 10.2.2.1) ns3::TcpHeader (49153 > 300 [ACK] Seq=1609 Ack=1 Win=32768 ns3::TcpOptionTS(2271;1957) ns3::TcpOptionEnd(EOL)) Payload Fragment [72:512] Payload Fragment [0:96]
t 2.59755 /NodeList/1/$ns3::Ipv4L3Protocol/Tx(3) ns3::Ipv4Header (tos 0x0 DSCP Default ECN Not-ECT ttl 62 id 5 protocol 6 offset (bytes) 0 flags [none] length: 588 10.1.1.1 > 10.2.2.1) ns3::TcpHeader (49153 > 300 [ACK] Seq=1609 Ack=1 Win=32768 ns3::TcpOptionTS(2271;1957) ns3::TcpOptionEnd(EOL)) Payload Fragment [72:512] Payload Fragment [0:96]
r 2.62341 /NodeList/0/$ns3::Ipv4L3Protocol/Rx(3) ns3::Ipv4Header (tos 0x0 DSCP Default ECN Not-ECT ttl 64 id 6 protocol 6 offset (bytes) 0 flags [none] length: 588 10.1.2.1 > 10.2.3.1) ns3::TcpHeader (49153 > 300 [ACK] Seq=2145 Ack=1 Win=32768 ns3::TcpOptionTS(2460;2146) ns3::TcpOptionEnd(EOL)) Payload Fragment [96:512] Payload Fragment [0:120]
t 2.62341 /NodeList/0/$ns3::Ipv4L3Protocol/Tx(1) ns3::Ipv4Header (tos 0x0 DSCP Default ECN Not-ECT ttl 63 id 6 protocol 6 offset (bytes) 0 flags [none] length: 588 10.1.2.1 > 10.2.3.1) ns3::TcpHeader (49153 > 300 [ACK] Seq=2145 Ack=1 Win=32768 ns3::TcpOptionTS(2460;2146) ns3::TcpOptionEnd(EOL)) Payload Fragment [96:512] Payload Fragment [0:120]
r 2.65488 /NodeList/0/$ns3::Ipv4L3Protocol/Rx(3) ns3::Ipv4Header (tos 0x0 DSCP Default ECN Not-ECT ttl 64 id 7 protocol 6 offset (bytes) 0 flags [none] length: 588 10.1.2.1 > 10.2.3.1) ns3::TcpHeader (49153 > 300 [ACK] Seq=2681 Ack=1 Win=32768 ns3::TcpOptionTS(2460;2146) ns3::TcpOptionEnd(EOL)) Payload Fragment [120:512] Payload Fragment [0:144]
t 2.65488 /NodeList/0/$ns3::Ipv4L3Protocol/Tx(1) ns3::Ipv4Header (tos 0x0 DSCP Default ECN Not-ECT ttl 63 id 7 protocol 6 offset (bytes) 0 flags [none] length: 588 10.1.2.1 > 10.2.3.1) ns3::TcpHeader (49153 > 300 [ACK] Seq=2681 Ack=1 Win=32768 ns3::TcpOptionTS(2460;2146) ns3::TcpOptionEnd(EOL)) Payload Fragment [120:512] Payload Fragment [0:144]
r 2.69195 /NodeList/1/$ns3::Ipv4L3Protocol/Rx(1) ns3::Ipv4Header (tos 0x0 DSCP Default ECN Not-ECT ttl 63 id 6 protocol 6 offset (bytes) 0 flags [none] length: 588 10.1.1.1 > 10.2.2.1) ns3::TcpHeader (49153 > 300 [ACK] Seq=2145 Ack=1 Win=32768 ns3::TcpOptionTS(2271;1957) ns3::TcpOptionEnd(EOL)) Payload Fragment [96:512] Payload Fragment [0:120]
t 2.69195 /NodeList/1/$ns3::Ipv4L3Protocol/Tx(3) ns3::Ipv4Header (tos 0x0 DSCP Default ECN Not-ECT ttl 62 id 6 protocol 6 offset (bytes) 0 flags [none] length: 588 10.1.1.1 > 10.2.2.1) ns3::TcpHeader (49153 > 300 [ACK] Seq=2145 Ack=1 Win=32768 ns3::TcpOptionTS(2271;1957) ns3::TcpOptionEnd(EOL)) Payload Fragment [96:512] Payload Fragment [0:120]
r 2.72901 /NodeList/6/$ns3::Ipv4L3Protocol/Rx(1) ns3::Ipv4Header (tos 0x0 DSCP Default ECN Not-ECT ttl 62 id 5 protocol 6 offset (bytes) 0 flags [none] length: 588 10.1.1.1 > 10.2.2.1) ns3::TcpHeader (49153 > 300 [ACK] Seq=1609 Ack=1 Win=32768 ns3::TcpOptionTS(2271;1957) ns3::TcpOptionEnd(EOL)) Payload Fragment [72:512] Payload Fragment [0:96]
r 2.78635 /NodeList/1/$ns3::Ipv4L3Protocol/Rx(1) ns3::Ipv4Header (tos 0x0 DSCP Default ECN Not-ECT ttl 63 id 7 protocol 6 offset (bytes) 0 flags [none] length: 588 10.1.1.1 > 10.2.2.1) ns3::TcpHeader (49153 > 300 [ACK] Seq=2681 Ack=1 Win=32768 ns3::TcpOptionTS(2271;1957) ns3::TcpOptionEnd(EOL)) Payload Fragment [120:512] Payload Fragment [0:144]
